Date Text,Text Text,location,oblast,date,time,timezone,Year,Month,Day,Season,AM_PM
14.08.2023 10:46:42 UTC+03:00,"РУБпАК «АХІЛЛЕС» 92-ї ОМБр ФПВ дроном влучає в Т-72Б та знищує його скидами на південний захід від населеного пункту Куземівка, Луганська область.Location: SW of Kuzemivka, Luhansk Oblast, Ukraine49.513305, 37.964719Source:https://t.me/fedorenkoys/81",sw of kuzemivka - luhansk oblast - ukraine.,luhansk,2023-08-14,07:46:42,2023-08-14 10:46:42,2023,8,14,Summer,AM
14.08.2023 18:37:34 UTC+03:00,"Російські війська знищують український ЗРК ""С-300"" на південний захід від населеного пункту Зелений Гай, Миколаївська область.Location: SW of Zelenyi Hai, Mykolaiv Oblast, Ukraine46.925064, 32.233937Source:https://t.me/mod_russia/29273",sw of zelenyi hai - mykolaiv oblast - ukraine.,mykolaiv,2023-08-14,15:37:34,2023-08-14 18:37:34,2023,8,14,Summer,PM
14.08.2023 19:14:29 UTC+03:00,"Воїни 73-го морського центру ССО ФПВ дроном атакують російський човен на південний схід від населеного пункту Велетенське, Херсонська область.Location: SE of Veletenske, Kherson Oblast, Ukraine46.540243, 32.407925Source:https://t.me/ukr_sof/693",se of veletenske - kherson oblast - ukraine.,kherson,2023-08-14,16:14:29,2023-08-14 19:14:29,2023,8,14,Summer,PM
14.08.2023 20:52:05 UTC+03:00,"116-та бригада ТрО знищує польовий склад з боєкомплектом поблизу населеного пункту Веселе, Донецька область.Location: Vesele, Yasynuvata Raion, Donetsk Oblast, Ukraine48.190548, 37.748703Source:https://www.facebook.com/brygada.TrO.Poltava/videos/677607430889795/",vesele - yasynuvata raion - donetsk oblast,donetsk,2023-08-14,17:52:05,2023-08-14 20:52:05,2023,8,14,Summer,PM
14.08.2023 22:41:36 UTC+03:00,"Спецпризначенці 2-го загону ЦСП НГУ «Омега» ФПВ дронами атакують російський танк на південь від населеного пункту Паталахівка, Луганська область.Location: S of Patalakhivka, Luhansk Oblast, Ukraine49.385480,38.000467Source:https://t.me/Centr_omega_NGU/627",s of patalakhivka - luhansk oblast - ukraine.,luhansk,2023-08-14,19:41:36,2023-08-14 22:41:36,2023,8,14,Summer,PM
15.08.2023 16:23:24 UTC+03:00,"Російська артилерія обстрілює українські позиції на північний захід від населеного пункту Землянки, Харківська область.Location: NW of Zemlianky, Kharkiv Oblast, Ukraine50.407807, 37.441192Source:https://t.me/neizvestnyiotryad/925",nw of zemlianky - kharkiv oblast - ukraine.,kharkiv,2023-08-15,13:23:24,2023-08-15 16:23:24,2023,8,15,Summer,PM
15.08.2023 17:49:16 UTC+03:00,"Російський дрон фільмує обстріл своїх військових, які втратили орієнтир в населеному пункті Урожайне, Донецька область. Заявлено про відсутність контрбатарейної боротьби.Location: Urozhaine, Donetsk Oblast, Ukraine47.745970, 36.822139Source:https://t.me/dugout_uncle_zhora/205",urozhaine - donetsk oblast - ukraine.,donetsk,2023-08-15,14:49:16,2023-08-15 17:49:16,2023,8,15,Summer,PM
15.08.2023 19:53:59 UTC+03:00,"HIMARS знищує 3 пускові установки ЗРК С-300В та пошкоджує дві радіолокаційні системи в районі населеного пункту Привілля та Олександрівка, Херсонська область.Location:SE of Pryvillia, Kherson Oblast, Ukraine1:47 -46.138587, 33.3693441:47 -46.121935, 33.378065NW of Oleksandrivka, Kherson Oblast, Ukraine1:52 -46.124406, 33.428333Source:https://t.me/SJTF_Odesa/136",se of pryvillia - kherson oblast - ukraine: -.,kherson,2023-08-15,16:53:59,2023-08-15 19:53:59,2023,8,15,Summer,PM
16.08.2023 09:12:54 UTC+03:00,"3-й окремий полк ССО знищує станцію перешкод Р-330Ж «Житель», машину технічної підтримки і танк в населеному пункті Луганське, Донецька область.Location: Luhanske, Donetsk Oblast, Ukraine48.437158, 38.235780Source:https://t.me/ukr_sof/695",luhanske - donetsk oblast - ukraine.,donetsk,2023-08-16,06:12:54,2023-08-16 09:12:54,2023,8,16,Summer,AM
16.08.2023 12:31:06 UTC+03:00,"Російські військові навчання з використанням техніки на території Запорізької атомної електростанції, Енергодар, Запорізька область.Location: Zaporizhzhia Nuclear Power Plant, Enerhodar, Zaporizhzhia Oblast, Ukraine47.516139, 34.586915Source:https://t.me/projectRHBZ/3208",zaporizhzhia nuclear power plant - enerhodar - zaporizhzhia oblast,zaporizhzhia,2023-08-16,09:31:06,2023-08-16 12:31:06,2023,8,16,Summer,AM
16.08.2023 16:05:44 UTC+03:00,"Заявлено про знищення двох Д-30 силами зведеної групи ГУ СБУ та 67 ОГАДн на південний схід від населеного пункту Пойма, Херсонська область.Location: SE of Poima, Kherson Oblast46.602267,32.86934546.608217,32.868578Source:https://t.me/ukrbavovna/10058",se of poima - kherson oblast. - ..,kherson,2023-08-16,13:05:44,2023-08-16 16:05:44,2023,8,16,Summer,PM
16.08.2023 17:15:35 UTC+03:00,"ФПВ дрон ДПСУ знищує російський комплекс радіоелектронної розвідки в населеному пункті Олешки, Херсонська область.Location: Oleshky, Kherson Oblast, Ukraine46.627626, 32.723991Source:https://t.me/DPSUkr/12923",oleshky - kherson oblast - ukraine.,kherson,2023-08-16,14:15:35,2023-08-16 17:15:35,2023,8,16,Summer,PM
16.08.2023 17:57:22 UTC+03:00,"HIMARS знищує російських військових на захід від населеного пункту Приморське, Херсонська область.Location: W of Prymorske, Kherson Oblast, Ukraine46.100692, 32.394182Source:https://t.me/sprotyv_official/2713",w of prymorske - kherson oblast - ukraine.,kherson,2023-08-16,14:57:22,2023-08-16 17:57:22,2023,8,16,Summer,PM
16.08.2023 20:08:43 UTC+03:00,"Російський військовий демонструє свої позиції на залізничній станції в Куземівці, Луганська область.Location: Train station Kuzemivka, Luhansk Oblast, Ukraine49.523325, 37.959410Source:https://t.me/avcgroup/154Геолокація для геолокації:https://twitter.com/blinzka/status/1684588240534220800",train station kuzemivka - luhansk oblast - ukraine.,luhansk,2023-08-16,17:08:43,2023-08-16 20:08:43,2023,8,16,Summer,PM
16.08.2023 22:45:02 UTC+03:00,"Бійці штурмового полку «Цунамі» ОШБр «Лють» НПУ штурмують російські позиції в південній частині Кліщіївки, Донецька область.Location: Klishchiivka, Donetsk Oblast, Ukraine48.524695, 37.956428Source:https://www.facebook.com/100011277456013/videos/971412640852608/",klishchiivka - donetsk oblast - ukraine.,donetsk,2023-08-16,19:45:02,2023-08-16 22:45:02,2023,8,16,Summer,PM
17.08.2023 12:28:20 UTC+03:00,"2С1 ""Гвоздіка"" 22-ї механізованої бригади обстрілює російську позицію в населеному пункті Одрадівка, Донецька область.Location: Odradivka, Donetsk Oblast, Ukraine48.511701, 38.019051Source:https://t.me/osirskiy/273",odradivka - donetsk oblast - ukraine.,donetsk,2023-08-17,09:28:20,2023-08-17 12:28:20,2023,8,17,Summer,AM
17.08.2023 18:36:12 UTC+03:00,"Спецпризначенці 4-го загону ЦСП НГУ «Омега» ФПВ дроном знищують російську БМП на північний схід від населеного пункту Володине, Донецька область.Location: NE of Volodyne, Donetsk Oblast, Ukraine47.712456, 36.763647Source:https://t.me/Centr_omega_NGU/655",ne of volodyne - donetsk oblast - ukraine.,donetsk,2023-08-17,15:36:12,2023-08-17 18:36:12,2023,8,17,Summer,PM
17.08.2023 20:59:10 UTC+03:00,"Російська артилерія обстрілює українські позиції в населеному пункті Роботине, Запорізька область.Location: Robotyne, Zaporizhzhia Oblast, Ukraine47.455820, 35.824858Source:https://t.me/rusich_army/10436",robotyne - zaporizhzhia oblast - ukraine.,zaporizhzhia,2023-08-17,17:59:10,2023-08-17 20:59:10,2023,8,17,Summer,PM
17.08.2023 23:28:48 UTC+03:00,"123-тя бригада ТрО робить скид на російські позиції на Острові Великий Потьомкін, Херсонська область.Location: Ostriv Velykyi Potomkin, Kherson Oblast, Ukraine46.556504, 32.512988Source:https://www.facebook.com/100078723046313/videos/146579168487738/",ostriv velykyi potomkin - kherson oblast - ukraine.,kherson,2023-08-17,20:28:48,2023-08-17 23:28:48,2023,8,17,Summer,PM
18.08.2023 02:07:12 UTC+03:00,"Аеророзвідка 129-ї ОБрТрО та 55 ОАБр знищують польовий склад з боєкомплектом на південний схід від населеного пункту Ключове, Донецька область.Location: SE of Kliuchove, Donetsk Oblast, Ukraine47.668843, 36.879128Source:https://t.me/kolesnyknews/207",se of kliuchove - donetsk oblast - ukraine.,donetsk,2023-08-17,23:07:12,2023-08-18 02:07:12,2023,8,17,Summer,PM
18.08.2023 11:50:21 UTC+03:00,"503 мсп та 810 обрмп рф обстрілюють українські позиції в населеному пункті Роботине, Запорізька область.Location: Robotyne, Zaporizhzhia Oblast, Ukraine47.450940, 35.838696Source:https://t.me/dva_majors/23799",robotyne - zaporizhzhia oblast - ukraine.,zaporizhzhia,2023-08-18,08:50:21,2023-08-18 11:50:21,2023,8,18,Summer,AM
18.08.2023 16:38:44 UTC+03:00,"Дрон-камікадзе Shahed 136 знищує українську РЛС СТ-68У на південь від населеного пункту Червоне, Миколаївська область.Location: S of Chervone, Mykolaiv Raion, Mykolaiv Oblast, Ukraine47.036712, 32.382243Source:https://t.me/namarshe/6739",s of chervone - mykolaiv raion - mykolaiv oblast,mykolaiv,2023-08-18,13:38:44,2023-08-18 16:38:44,2023,8,18,Summer,PM
18.08.2023 18:49:28 UTC+03:00,"Заявлено, як вибух на нараді керівників окупаційної поліції в Енергодарі, Запорізька область.Location: Enerhodar, Zaporizhzhia Oblast, Ukraine47.502525, 34.652345Source:https://twitter.com/DI_Ukraine/status/1692557812751090126",enerhodar - zaporizhzhia oblast - ukraine.,zaporizhzhia,2023-08-18,15:49:28,2023-08-18 18:49:28,2023,8,18,Summer,PM
18.08.2023 21:23:12 UTC+03:00,"Російські телеграм канали демонструють відео росіян в східній частині Козачих Лагерів, Херсонська область.Location: Kozachi Laheri, Kherson Oblast, Ukraine0:01 -46.708431, 32.9760920:08 -46.708385, 32.980325Source:https://t.me/RVvoenkor/51536",kozachi laheri - kherson oblast - ukraine: -.,kherson,2023-08-18,18:23:12,2023-08-18 21:23:12,2023,8,18,Summer,PM
18.08.2023 23:18:42 UTC+03:00,"43-тя окрема механізована бригада ФПВ дроном знищує російську вантажівку на північний схід від населеного пункту Ковалівка, Луганська область.Location: NE of Kovalivka, Luhansk Oblast, Ukraine49.354001, 38.026506Source:https://www.facebook.com/100092925724373/videos/962647041675309",ne of kovalivka - luhansk oblast - ukraine.,luhansk,2023-08-18,20:18:42,2023-08-18 23:18:42,2023,8,18,Summer,PM
19.08.2023 13:39:56 UTC+03:00,"Заявлено про влучання БПЛА по авіабазі ""Сольци"" де базуються Ту-22м3 в населеному пункті Сольці, Новгородська область.Location: Soltsy, Novgorod Oblast, RussiaPov:58.128123, 30.369548Source:https://t.me/pvn53/4826",soltsy - novgorod oblast - russiapov:.,novgorod,2023-08-19,10:39:56,2023-08-19 13:39:56,2023,8,19,Summer,AM
19.08.2023 16:21:29 UTC+03:00,"Заявлено про знищення 2С9 «Нона-С» 44-ю артилерійською бригадою на південний захід від населеного пункту Вербове, Запорізька область.Location: SW of Verbove, Zaporizhia Oblast, Ukraine47.401168, 35.950409Source:https://t.me/mysiagin/25910",sw of verbove - zaporizhia oblast - ukraine.,zaporizhia,2023-08-19,13:21:29,2023-08-19 16:21:29,2023,8,19,Summer,PM
19.08.2023 20:31:22 UTC+03:00,"Російський літак запускає ФАБ-500М-62 з УМПК в районі населеного пункту Чаплинка, Херсонська область.Location: Chaplynka, Kherson Oblast, Ukraine46.361600, 33.540000Source:https://t.me/zhurnalistka_z/2537",chaplynka - kherson oblast - ukraine.,kherson,2023-08-19,17:31:22,2023-08-19 20:31:22,2023,8,19,Summer,PM
19.08.2023 23:03:06 UTC+03:00,"ДШРГ ""Русіч"" демонструє знищену українську техніку на північний захід від населеного пункту Вербове, Запорізька область.Location: NW of Verbove, Zaporizhia Oblast, Ukraine47.453003, 35.905435Source:https://t.me/dshrg2/1174",nw of verbove - zaporizhia oblast - ukraine.,zaporizhia,2023-08-19,20:03:06,2023-08-19 23:03:06,2023,8,19,Summer,PM
20.08.2023 11:32:44 UTC+03:00,"71-ша єгерська бригада ФПВ дроном атакує російські позиції на північний захід від населеного пункту Вербове, Запорізька область.Location: NW of Verbove, Zaporizhia Oblast, Ukraine0:16-0:24 -47.453474, 35.907961Source:https://t.me/ua_dshv/1523",nw of verbove - zaporizhia oblast - ukraine:-: -.,zaporizhia,2023-08-20,08:32:44,2023-08-20 11:32:44,2023,8,20,Summer,AM
20.08.2023 14:09:59 UTC+03:00,"Робота трьох БМП M2A2 «Bradley» на північний схід від населеного пункту Роботине, Запорізька область.Location: NE of Robotyne, Zaporizhzhia Oblast, Ukraine47.458706, 35.850832Source:https://t.me/pj_notes/244",ne of robotyne - zaporizhzhia oblast - ukraine.,zaporizhzhia,2023-08-20,11:09:59,2023-08-20 14:09:59,2023,8,20,Summer,AM
20.08.2023 20:44:27 UTC+03:00,"100 ОБрТрО, батальйон Нацполіції «Захід» та 45 ОАБр знищують 2С4 «Тюльпан» на південний захід від населеного пункту Кремінна, Луганська область.Location: SW of Kreminna, Luhansk Oblast, Ukraine49.013920, 38.166612Source:https://t.me/Volyn100obrTrO/820",sw of kreminna - luhansk oblast - ukraine.,luhansk,2023-08-20,17:44:27,2023-08-20 20:44:27,2023,8,20,Summer,PM
21.08.2023 00:40:24 UTC+03:00,"Заявлено про покинутий (?) Леопард (?) на північний схід від населеного пункту Роботине, Запорізька область.Location: NE of Robotyne, Zaporizhzhia Oblast, Ukraine47.458276, 35.899399Source:https://t.me/rusich_army/10475",ne of robotyne - zaporizhzhia oblast - ukraine.,zaporizhzhia,2023-08-20,21:40:24,2023-08-21 00:40:24,2023,8,20,Summer,PM
21.08.2023 16:58:36 UTC+03:00,"РУБпАК ""Шершні Довбуша"" 68-ї ОЄБр скидом знищують польвий склад з боєкомплектом на північний захід від населеного пункту Нововодяне, Луганська область.Location: NW of Novovodiane, Luhansk Oblast49.291218, 38.001490Source:https://www.facebook.com/68brigade/videos/645104750931489",nw of novovodiane - luhansk oblast. - .source:https://www.facebook.com/brigade/videos/,luhansk,2023-08-21,13:58:36,2023-08-21 16:58:36,2023,8,21,Summer,PM
21.08.2023 18:29:02 UTC+03:00,"Артилерія 503-го полку рф обстрілює українські позиції в північно західній частині Роботиного, Запорізька область.Location: Robotyne, Zaporizhzhia Oblast, Ukraine47.450029, 35.828826Source:t.me/wargonzo/14504",robotyne - zaporizhzhia oblast - ukraine.,zaporizhzhia,2023-08-21,15:29:02,2023-08-21 18:29:02,2023,8,21,Summer,PM
22.08.2023 10:55:01 UTC+03:00,"Українські військові штурмують південно східну частину Роботиного за підтримки БМП M2A2 «Bradley», Запорізька область.Location: Robotyne, Zaporizhzhia Oblast, Ukraine47.443740, 35.843219Source:https://t.me/Force_Major_ua/44",robotyne - zaporizhzhia oblast - ukraine.,zaporizhzhia,2023-08-22,07:55:01,2023-08-22 10:55:01,2023,8,22,Summer,AM
22.08.2023 17:00:58 UTC+03:00,"Російський спецназ ""Ахмат"" спостерігає за знищеним українським польвим складом в південно західній частині Кліщіївки, Донецька область.Location: Klishchiivka, Donetsk Oblast, Ukraine48.527410, 37.951159Source:https://t.me/DKulko/399",klishchiivka - donetsk oblast - ukraine.,donetsk,2023-08-22,14:00:58,2023-08-22 17:00:58,2023,8,22,Summer,PM
22.08.2023 21:12:54 UTC+03:00,"⚡️Невеличкий ексклюзивРобота CV-90 по російським позиціям на північний схід від населеного пункту Синьківка, Харківська область.Location: NE of of Synkivka, Kharkiv Oblast, Ukraine49.777702, 37.737637",ne of of synkivka - kharkiv oblast - ukraine.,kharkiv,2023-08-22,18:12:54,2023-08-22 21:12:54,2023,8,22,Summer,PM
22.08.2023 23:25:16 UTC+03:00,"ФПВ дрон спецназу рф ""Осман"" атакує українську позицію на північний захід від населеного пункту Вербове, Запорізька область.Location: NW of Verbove, Zaporizhia Oblast, Ukraine47.447232, 35.919696Source:https://t.me/ZA_FROHT/21111",nw of verbove - zaporizhia oblast - ukraine.,zaporizhia,2023-08-22,20:25:16,2023-08-22 23:25:16,2023,8,22,Summer,PM
23.08.2023 19:23:54 UTC+03:00,"47-ма окрема механізована бригада встановила прапор України в центрі населеного пункту Роботине, Запорізька область.Location: Robotyne, Zaporizhzhia Oblast, Ukraine47.443153, 35.835672Source:t.me/brygada47/97https://twitter.com/DefMon3/status/1691132354348175369",robotyne - zaporizhzhia oblast - ukraine.,zaporizhzhia,2023-08-23,16:23:54,2023-08-23 19:23:54,2023,8,23,Summer,PM
23.08.2023 21:09:03 UTC+03:00,"Заявлено про падіння літака, в якому можливо знаходився Євгеній Прігожин та Дмитро Уткін на південь від населеного пункту Куженкінскоє, Тверська область.Location: S of Kuzhenkinskoye, Tver Oblast57.747663, 33.954326",s of kuzhenkinskoye - tver oblast. - .,tver,2023-08-23,18:09:03,2023-08-23 21:09:03,2023,8,23,Summer,PM
24.08.2023 11:05:52 UTC+03:00,"БМП ""Bradley"" проводить евакуацію українських військових під артилерійським обстрілом в південно східній частині Роботиного, Запорізька область.Location: Robotyne, Zaporizhzhia Oblast, Ukraine47.444020, 35.839483Source:t.me/wargonzo/14571",robotyne - zaporizhzhia oblast - ukraine.,zaporizhzhia,2023-08-24,08:05:52,2023-08-24 11:05:52,2023,8,24,Summer,AM
24.08.2023 14:19:24 UTC+03:00,"126-та бригада ТрО ФПВ дроном атакує ЗРГК ""Тунгуска"" на південний схід від населеного пункту Підстепне, Херсонська область.Location: SE of Pidstepne, Kherson Oblast, Ukraine46.642304, 32.913256Source:https://twitter.com/sternenko/status/1694648401055375749",se of pidstepne - kherson oblast - ukraine.,kherson,2023-08-24,11:19:24,2023-08-24 14:19:24,2023,8,24,Summer,AM
24.08.2023 18:04:59 UTC+03:00,"Батальйон ""Скала"" бере полонених та штурмує російські позиції в південній частині Роботиного, Запорізька область.Location: Robotyne, Zaporizhzhia Oblast, Ukraine47.439890, 35.840240Source:https://t.me/c/1534945236/16478",robotyne - zaporizhzhia oblast - ukraine.,zaporizhzhia,2023-08-24,15:04:59,2023-08-24 18:04:59,2023,8,24,Summer,PM
24.08.2023 21:54:14 UTC+03:00,"Росіяни публікують архівні кадри обстрілу ""Металургійного комбінату імені Ілліча"" прямою наводкою з БМ-21 ""Град"" в Маріуполі, Донецька область.Location: Mariupol, Donetsk Oblast, Ukraine47.174309, 37.567166Source:https://t.me/dugout_uncle_zhora/220",mariupol - donetsk oblast - ukraine.,donetsk,2023-08-24,18:54:14,2023-08-24 21:54:14,2023,8,24,Summer,PM
25.08.2023 12:19:39 UTC+03:00,"Заявлено про знищення з ПТРК БМП ""M2 Bradley"" в центральній частині Роботиного, Запорізька область.Location: Robotyne, Zaporizhzhia Oblast, Ukraine47.446188, 35.838239https://t.me/rusich_army/10540",robotyne - zaporizhzhia oblast - ukraine.,zaporizhzhia,2023-08-25,09:19:39,2023-08-25 12:19:39,2023,8,25,Summer,AM
25.08.2023 13:26:36 UTC+03:00,https://vxtwitter.com/Bazinga00264477/status/1695014546203623452,nan - nan - nan,,2023-08-25,10:26:36,2023-08-25 13:26:36,2023,8,25,Summer,AM
25.08.2023 15:19:34 UTC+03:00,"Заявлено про знищення могил вагнерівців на кладовищі, де Прігожин відкривав обеліск в населеному пункті Ніколаєвка, Самарська область.Location: Nykolaevka, Samara Oblast, Russia53.086779, 50.320352Source:https://t.me/voynareal/70125",nykolaevka - samara oblast - russia.,samara,2023-08-25,12:19:34,2023-08-25 15:19:34,2023,8,25,Summer,PM
25.08.2023 19:19:50 UTC+03:00,"РУБпАК ""Шершні Довбуша"" 68-ї ОЄБр роблять скиди на російські позиції, живу силу та техніку в Луганській області.Location: NW/E Novoiehorivka, Luhansk Oblast, Ukraine0:48-0:55 -49.340701, 37.9764370:55-1:02 -49.338767, 37.9784401:02-1:12 -49.339911, 37.9746221:20-1:28 -49.339432, 37.9750752:23-2:38 -49.339574, 37.9506932:49-3:02 -49.348386, 37.9350043:22-3:26 -49.348706, 37.9349623:40 -49.344496, 37.939034Source:https://t.me/shershni68/48",nw/e novoiehorivka - luhansk oblast - ukraine:-: -.,luhansk,2023-08-25,16:19:50,2023-08-25 19:19:50,2023,8,25,Summer,PM
25.08.2023 19:36:50 UTC+03:00,"Окремий загін спеціального призначення «Любарт» знищує 120-й міномет в населеному пункті Олешки, Херсонська область.Location: Oleshky, Kherson Oblast, Ukraine46.628074, 32.713937Source:https://t.me/ozspLubart/308",oleshky - kherson oblast - ukraine.,kherson,2023-08-25,16:36:50,2023-08-25 19:36:50,2023,8,25,Summer,PM
25.08.2023 21:35:17 UTC+03:00,Robotyne80 days in 18 frames,nan - nan - nan,,2023-08-25,18:35:17,2023-08-25 21:35:17,2023,8,25,Summer,PM
25.08.2023 22:09:04 UTC+03:00,"Аеророзвідники 55 об 100 обр ТрО корегують знищення двох ворожих БТРів на південний схід від населеного пункту Діброва, Луганська область.Location: SE of Dibrova, Luhansk Oblast, Ukraine48.989709, 38.117152Source:https://t.me/Volyn100obrTrO/831",se of dibrova - luhansk oblast - ukraine.,luhansk,2023-08-25,19:09:04,2023-08-25 22:09:04,2023,8,25,Summer,PM
25.08.2023 23:25:11 UTC+03:00,"Український ФПВ дрон атакує російський БТР з піхотою на схід від населеного пункту Райгородка, Луганська область.Location: E of Raihorodka, Luhansk Oblast, Ukraine49.379075, 37.975169Source:https://t.me/gostrikartuzy/100",e of raihorodka - luhansk oblast - ukraine.,luhansk,2023-08-25,20:25:11,2023-08-25 23:25:11,2023,8,25,Summer,PM
