Date Text,Text Text
07.08.2023 17:04:10 UTC+03:00,"63-й батальйон 103-ї бригади ТрО робить скид на російські позиції на північ від населеного пункту Новоселівське, Луганська область.Location: N of Novoselivske, Luhansk Oblast, Ukraine49.538814, 37.958202Source:https://t.me/it_ta_batia_63/55"
07.08.2023 20:25:12 UTC+03:00,"Підрозділ ""SHADOW"" ФПВ дроном знищує польовий склад з боєкомплектом на північний схід від населеного пункту Кременчик, Донецька область.Location: NE of Kermenchyk, Donetsk Oblast, Ukraine47.718896, 36.959522Source:https://t.me/pidrozdilshadow/150"
07.08.2023 21:35:27 UTC+03:00,"Аеророзвідка 30-ї ОМБр коригує вогонь HIMARS по ворожій МСТА-Б на південь від населеного пункту Бахмутське, Донецька область.Location: S of Bakhmutske, Donetsk Oblast, Ukraine48.648392, 38.097428Source:https://t.me/osirskiy/255"
08.08.2023 16:34:11 UTC+03:00,"Підрозділ М2 ФПВ дроном знищує російський Т-80 в Бахмуті, Донецька область.Location: Bakhmut, Donetsk Oblast, Ukraine48.597173, 38.041091Source:https://t.me/ssternenko/19148"
08.08.2023 20:56:02 UTC+03:00,"Артилерія 63-ї окремої механізованої бригади обстрілює російські позиції на схід від населеного пункту Торське, Донецька область.Location: E of Torske, Donetsk Oblast, Ukraine49.022560, 38.012147Source:https://www.facebook.com/63ombr/videos/1006811257414889"
09.08.2023 09:26:45 UTC+03:00,"120-й міномет обстрілює українські позиції на північний захід від населеного пункту Лиман Перший, Харківська область.Location: NW of Lyman Pershyi, Kharkiv Oblast, Ukraine0:53-0:58 -49.800636, 37.680032Source:https://t.me/tass_agency/204526"
09.08.2023 13:32:45 UTC+03:00,"22-га окрема механізована бригада обстрілює російські позиції в населеному пункті Кліщіївка, Донецька область.Location: Klishchiivka, Donetsk Oblast, Ukraine48.527932, 37.958722Source:https://t.me/osirskiy/259"
09.08.2023 15:21:47 UTC+03:00,"Бригада ""Сталевий Кордон"" ФПВ дроном влучає в скупчення живої сили на схід від населеного пункту Бутирки, Бєлгородська область.Location: E of Butyrki, Belgorod Oblast, Russia50.179068, 37.670484Source:https://t.me/DPSUkr/12684"
09.08.2023 18:30:24 UTC+03:00,"Підрозділ ""Asgard"" ФПВ дроном влучає в російську БМП на схід від населеного пункту Андріївка, Донецька область.Location: E of Andriyivka, Donetsk Oblast, Ukraine48.503133, 37.993041Source:https://t.me/asgard_fpv/35"
09.08.2023 21:37:48 UTC+03:00,"Український танк обстрілює російські позиції в населеному пункті Урожайне, Донецька область.Location: Urozhaine, Donetsk Oblast, Ukraine47.756271, 36.815669Source:https://t.me/aeronavtyua/922"
10.08.2023 10:35:34 UTC+03:00,"Окрема президентська бригада ФПВ дроном влучає в російську БМП поблизу населеного пункту Урожайне, Донецька область.Location: near Urozhaine, Donetsk Oblast, Ukraine47.735108, 36.830315Source:https://t.me/wild_hornets/222"
10.08.2023 14:35:46 UTC+03:00,"ДПСУ обстрілює російські позиції з міномета поблизу населеного пункту Озарянівка, Донецька область.Location: near Ozarianivka, Donetsk Oblast, Ukraine48.457125, 37.952603Source:https://t.me/DPSUkr/12835"
10.08.2023 19:26:09 UTC+03:00,"Аеророзвідка 129-ї бригади ТрО коригує удар по російським позиціям в населеному пункті Урожайне, Донецька область.Location: Urozhaine, Donetsk Oblast, Ukraine47.747077, 36.818525Source:https://t.me/kolesnyknews/201"
10.08.2023 23:35:24 UTC+03:00,"126-та бригада ТрО знищує російський склад з боєкомплектом в населеному пункті Кринки, Херсонська область.Location: Krynky, Kherson Oblast, Ukraine46.717025, 33.025073Source:https://twitter.com/GloOouD/status/1689730613375369222"
11.08.2023 11:11:51 UTC+03:00,"Обстріл українських позицій з РСЗВ ""Чебурашка"" в населеному пункті Велика Новосілка, Донецька область.Location: Velyka Novosilka, Donetsk Oblast, Ukraine47.827990, 36.834538Source:https://t.me/dugout_uncle_zhora/195"
11.08.2023 18:33:39 UTC+03:00,"103 бригада ТрО та 25 ОПДБр знищують російський танк на схід від населеного пункту Джерельне, Луганська область.Location: E of Dzherelne, Luhansk Oblast, Ukraine49.414329, 37.970792Source:https://twitter.com/TonyaLevchuk/status/1690015775908618240"
11.08.2023 22:49:59 UTC+03:00,"15та бригада оперативного призначення обстрілює російські позиції на південний захід від населеного пункту Новопокровка, Запорізька область.Location: SW of Novopokrovka, Zaporizhzhia Oblast, Ukraine47.490342, 35.952484Source:https://t.me/gachi_defence/15099"
12.08.2023 16:25:19 UTC+03:00,"Момент падіння російського Су-30 поблизу населеного пункту Вершиніно, Калінінградська область. Екіпаж загинув.Location: Vershynino, Kaliningrad Oblast, RussiaPov:54.537066, 21.663403Source:https://t.me/ENews112/14942"
12.08.2023 17:01:23 UTC+03:00,"ЗРК ""Оса"" намагається збити ""Лелеку"" аеророзвідки 129-ї ОБрТРО. Оса робить постріл на захід від населеного пункту Новопетриківка, Донецька область.Location: W of Novopetrykivka, Donetsk Oblast47.636398, 36.894343Source:https://t.me/kolesnyknews/203"
12.08.2023 20:54:19 UTC+03:00,"Російський Т-90 3-го армійського корпусу рф обстрілює українські позиції з населеного пункту Андріївка, Донецька область.Location: Andriivka, Donetsk Oblast, Ukraine48.500132, 37.964480Source:https://t.me/verumreactor/5661"
13.08.2023 10:39:44 UTC+03:00,"Перша президентська бригада робить скид ФПВ дроном на російські позиції на схід від населеного пункту Урожайне, Донецьк область.Location: E of Urozhaine, Donetsk Oblast, Ukraine47.748335, 36.838357Source:https://t.me/wild_hornets/241"
13.08.2023 16:49:58 UTC+03:00,"Російський 82-й міномет обстрілює український бронетранспортер ""Rosomak"" на північний схід від населеного пункту Синьківка, Харківська область. З екіпажем все добре.Location: NE of Synkivka, Kharkiv Oblast, Ukraine49.770197, 37.724037Source:https://t.me/rian_ru/211969"
13.08.2023 20:16:43 UTC+03:00,"Бронегрупа 85-ї омсбр рф атакує українські позиції в південній частині Кліщіївки, Донецька область.Location: Klishchiivka, Donetsk Oblast, Ukraine48.521392, 37.955843Source:https://t.me/verumreactor/5681"
14.08.2023 00:02:19 UTC+03:00,"Пропагандисти з каналу ""Россия 24"" демонструють східну частину Козачих Лагерів, Херсонська область.Location: Kozachi Laheri, Kherson Oblast, Ukraine0:38 -46.710591, 32.9963291:21 -46.707689, 32.979082Source:https://t.me/margosemenyuk/131"
14.08.2023 10:46:42 UTC+03:00,"РУБпАК «АХІЛЛЕС» 92-ї ОМБр ФПВ дроном влучає в Т-72Б та знищує його скидами на південний захід від населеного пункту Куземівка, Луганська область.Location: SW of Kuzemivka, Luhansk Oblast, Ukraine49.513305, 37.964719Source:https://t.me/fedorenkoys/81"
14.08.2023 18:37:34 UTC+03:00,"Російські війська знищують український ЗРК ""С-300"" на південний захід від населеного пункту Зелений Гай, Миколаївська область.Location: SW of Zelenyi Hai, Mykolaiv Oblast, Ukraine46.925064, 32.233937Source:https://t.me/mod_russia/29273"
14.08.2023 19:14:29 UTC+03:00,"Воїни 73-го морського центру ССО ФПВ дроном атакують російський човен на південний схід від населеного пункту Велетенське, Херсонська область.Location: SE of Veletenske, Kherson Oblast, Ukraine46.540243, 32.407925Source:https://t.me/ukr_sof/693"
14.08.2023 20:52:05 UTC+03:00,"116-та бригада ТрО знищує польовий склад з боєкомплектом поблизу населеного пункту Веселе, Донецька область.Location: Vesele, Yasynuvata Raion, Donetsk Oblast, Ukraine48.190548, 37.748703Source:https://www.facebook.com/brygada.TrO.Poltava/videos/677607430889795/"
14.08.2023 22:41:36 UTC+03:00,"Спецпризначенці 2-го загону ЦСП НГУ «Омега» ФПВ дронами атакують російський танк на південь від населеного пункту Паталахівка, Луганська область.Location: S of Patalakhivka, Luhansk Oblast, Ukraine49.385480,38.000467Source:https://t.me/Centr_omega_NGU/627"
15.08.2023 16:23:24 UTC+03:00,"Російська артилерія обстрілює українські позиції на північний захід від населеного пункту Землянки, Харківська область.Location: NW of Zemlianky, Kharkiv Oblast, Ukraine50.407807, 37.441192Source:https://t.me/neizvestnyiotryad/925"
15.08.2023 17:49:16 UTC+03:00,"Російський дрон фільмує обстріл своїх військових, які втратили орієнтир в населеному пункті Урожайне, Донецька область. Заявлено про відсутність контрбатарейної боротьби.Location: Urozhaine, Donetsk Oblast, Ukraine47.745970, 36.822139Source:https://t.me/dugout_uncle_zhora/205"
15.08.2023 19:53:59 UTC+03:00,"HIMARS знищує 3 пускові установки ЗРК С-300В та пошкоджує дві радіолокаційні системи в районі населеного пункту Привілля та Олександрівка, Херсонська область.Location:SE of Pryvillia, Kherson Oblast, Ukraine1:47 -46.138587, 33.3693441:47 -46.121935, 33.378065NW of Oleksandrivka, Kherson Oblast, Ukraine1:52 -46.124406, 33.428333Source:https://t.me/SJTF_Odesa/136"
16.08.2023 09:12:54 UTC+03:00,"3-й окремий полк ССО знищує станцію перешкод Р-330Ж «Житель», машину технічної підтримки і танк в населеному пункті Луганське, Донецька область.Location: Luhanske, Donetsk Oblast, Ukraine48.437158, 38.235780Source:https://t.me/ukr_sof/695"
16.08.2023 12:31:06 UTC+03:00,"Російські військові навчання з використанням техніки на території Запорізької атомної електростанції, Енергодар, Запорізька область.Location: Zaporizhzhia Nuclear Power Plant, Enerhodar, Zaporizhzhia Oblast, Ukraine47.516139, 34.586915Source:https://t.me/projectRHBZ/3208"
16.08.2023 16:05:44 UTC+03:00,"Заявлено про знищення двох Д-30 силами зведеної групи ГУ СБУ та 67 ОГАДн на південний схід від населеного пункту Пойма, Херсонська область.Location: SE of Poima, Kherson Oblast46.602267,32.86934546.608217,32.868578Source:https://t.me/ukrbavovna/10058"
16.08.2023 17:15:35 UTC+03:00,"ФПВ дрон ДПСУ знищує російський комплекс радіоелектронної розвідки в населеному пункті Олешки, Херсонська область.Location: Oleshky, Kherson Oblast, Ukraine46.627626, 32.723991Source:https://t.me/DPSUkr/12923"
16.08.2023 17:57:22 UTC+03:00,"HIMARS знищує російських військових на захід від населеного пункту Приморське, Херсонська область.Location: W of Prymorske, Kherson Oblast, Ukraine46.100692, 32.394182Source:https://t.me/sprotyv_official/2713"
16.08.2023 20:08:43 UTC+03:00,"Російський військовий демонструє свої позиції на залізничній станції в Куземівці, Луганська область.Location: Train station Kuzemivka, Luhansk Oblast, Ukraine49.523325, 37.959410Source:https://t.me/avcgroup/154Геолокація для геолокації:https://twitter.com/blinzka/status/1684588240534220800"
16.08.2023 22:45:02 UTC+03:00,"Бійці штурмового полку «Цунамі» ОШБр «Лють» НПУ штурмують російські позиції в південній частині Кліщіївки, Донецька область.Location: Klishchiivka, Donetsk Oblast, Ukraine48.524695, 37.956428Source:https://www.facebook.com/100011277456013/videos/971412640852608/"
17.08.2023 12:28:20 UTC+03:00,"2С1 ""Гвоздіка"" 22-ї механізованої бригади обстрілює російську позицію в населеному пункті Одрадівка, Донецька область.Location: Odradivka, Donetsk Oblast, Ukraine48.511701, 38.019051Source:https://t.me/osirskiy/273"
17.08.2023 18:36:12 UTC+03:00,"Спецпризначенці 4-го загону ЦСП НГУ «Омега» ФПВ дроном знищують російську БМП на північний схід від населеного пункту Володине, Донецька область.Location: NE of Volodyne, Donetsk Oblast, Ukraine47.712456, 36.763647Source:https://t.me/Centr_omega_NGU/655"
17.08.2023 20:59:10 UTC+03:00,"Російська артилерія обстрілює українські позиції в населеному пункті Роботине, Запорізька область.Location: Robotyne, Zaporizhzhia Oblast, Ukraine47.455820, 35.824858Source:https://t.me/rusich_army/10436"
17.08.2023 23:28:48 UTC+03:00,"123-тя бригада ТрО робить скид на російські позиції на Острові Великий Потьомкін, Херсонська область.Location: Ostriv Velykyi Potomkin, Kherson Oblast, Ukraine46.556504, 32.512988Source:https://www.facebook.com/100078723046313/videos/146579168487738/"
18.08.2023 02:07:12 UTC+03:00,"Аеророзвідка 129-ї ОБрТрО та 55 ОАБр знищують польовий склад з боєкомплектом на південний схід від населеного пункту Ключове, Донецька область.Location: SE of Kliuchove, Donetsk Oblast, Ukraine47.668843, 36.879128Source:https://t.me/kolesnyknews/207"
18.08.2023 11:50:21 UTC+03:00,"503 мсп та 810 обрмп рф обстрілюють українські позиції в населеному пункті Роботине, Запорізька область.Location: Robotyne, Zaporizhzhia Oblast, Ukraine47.450940, 35.838696Source:https://t.me/dva_majors/23799"
18.08.2023 16:38:44 UTC+03:00,"Дрон-камікадзе Shahed 136 знищує українську РЛС СТ-68У на південь від населеного пункту Червоне, Миколаївська область.Location: S of Chervone, Mykolaiv Raion, Mykolaiv Oblast, Ukraine47.036712, 32.382243Source:https://t.me/namarshe/6739"
18.08.2023 18:49:28 UTC+03:00,"Заявлено, як вибух на нараді керівників окупаційної поліції в Енергодарі, Запорізька область.Location: Enerhodar, Zaporizhzhia Oblast, Ukraine47.502525, 34.652345Source:https://twitter.com/DI_Ukraine/status/1692557812751090126"
18.08.2023 21:23:12 UTC+03:00,"Російські телеграм канали демонструють відео росіян в східній частині Козачих Лагерів, Херсонська область.Location: Kozachi Laheri, Kherson Oblast, Ukraine0:01 -46.708431, 32.9760920:08 -46.708385, 32.980325Source:https://t.me/RVvoenkor/51536"
18.08.2023 23:18:42 UTC+03:00,"43-тя окрема механізована бригада ФПВ дроном знищує російську вантажівку на північний схід від населеного пункту Ковалівка, Луганська область.Location: NE of Kovalivka, Luhansk Oblast, Ukraine49.354001, 38.026506Source:https://www.facebook.com/100092925724373/videos/962647041675309"
19.08.2023 13:39:56 UTC+03:00,"Заявлено про влучання БПЛА по авіабазі ""Сольци"" де базуються Ту-22м3 в населеному пункті Сольці, Новгородська область.Location: Soltsy, Novgorod Oblast, RussiaPov:58.128123, 30.369548Source:https://t.me/pvn53/4826"
19.08.2023 16:21:29 UTC+03:00,"Заявлено про знищення 2С9 «Нона-С» 44-ю артилерійською бригадою на південний захід від населеного пункту Вербове, Запорізька область.Location: SW of Verbove, Zaporizhia Oblast, Ukraine47.401168, 35.950409Source:https://t.me/mysiagin/25910"
19.08.2023 20:31:22 UTC+03:00,"Російський літак запускає ФАБ-500М-62 з УМПК в районі населеного пункту Чаплинка, Херсонська область.Location: Chaplynka, Kherson Oblast, Ukraine46.361600, 33.540000Source:https://t.me/zhurnalistka_z/2537"
19.08.2023 23:03:06 UTC+03:00,"ДШРГ ""Русіч"" демонструє знищену українську техніку на північний захід від населеного пункту Вербове, Запорізька область.Location: NW of Verbove, Zaporizhia Oblast, Ukraine47.453003, 35.905435Source:https://t.me/dshrg2/1174"
20.08.2023 11:32:44 UTC+03:00,"71-ша єгерська бригада ФПВ дроном атакує російські позиції на північний захід від населеного пункту Вербове, Запорізька область.Location: NW of Verbove, Zaporizhia Oblast, Ukraine0:16-0:24 -47.453474, 35.907961Source:https://t.me/ua_dshv/1523"
20.08.2023 14:09:59 UTC+03:00,"Робота трьох БМП M2A2 «Bradley» на північний схід від населеного пункту Роботине, Запорізька область.Location: NE of Robotyne, Zaporizhzhia Oblast, Ukraine47.458706, 35.850832Source:https://t.me/pj_notes/244"
20.08.2023 20:44:27 UTC+03:00,"100 ОБрТрО, батальйон Нацполіції «Захід» та 45 ОАБр знищують 2С4 «Тюльпан» на південний захід від населеного пункту Кремінна, Луганська область.Location: SW of Kreminna, Luhansk Oblast, Ukraine49.013920, 38.166612Source:https://t.me/Volyn100obrTrO/820"
21.08.2023 00:40:24 UTC+03:00,"Заявлено про покинутий (?) Леопард (?) на північний схід від населеного пункту Роботине, Запорізька область.Location: NE of Robotyne, Zaporizhzhia Oblast, Ukraine47.458276, 35.899399Source:https://t.me/rusich_army/10475"
21.08.2023 16:58:36 UTC+03:00,"РУБпАК ""Шершні Довбуша"" 68-ї ОЄБр скидом знищують польвий склад з боєкомплектом на північний захід від населеного пункту Нововодяне, Луганська область.Location: NW of Novovodiane, Luhansk Oblast49.291218, 38.001490Source:https://www.facebook.com/68brigade/videos/645104750931489"
21.08.2023 18:29:02 UTC+03:00,"Артилерія 503-го полку рф обстрілює українські позиції в північно західній частині Роботиного, Запорізька область.Location: Robotyne, Zaporizhzhia Oblast, Ukraine47.450029, 35.828826Source:t.me/wargonzo/14504"
22.08.2023 10:55:01 UTC+03:00,"Українські військові штурмують південно східну частину Роботиного за підтримки БМП M2A2 «Bradley», Запорізька область.Location: Robotyne, Zaporizhzhia Oblast, Ukraine47.443740, 35.843219Source:https://t.me/Force_Major_ua/44"
22.08.2023 17:00:58 UTC+03:00,"Російський спецназ ""Ахмат"" спостерігає за знищеним українським польвим складом в південно західній частині Кліщіївки, Донецька область.Location: Klishchiivka, Donetsk Oblast, Ukraine48.527410, 37.951159Source:https://t.me/DKulko/399"
22.08.2023 21:12:54 UTC+03:00,"⚡️Невеличкий ексклюзивРобота CV-90 по російським позиціям на північний схід від населеного пункту Синьківка, Харківська область.Location: NE of of Synkivka, Kharkiv Oblast, Ukraine49.777702, 37.737637"
22.08.2023 23:25:16 UTC+03:00,"ФПВ дрон спецназу рф ""Осман"" атакує українську позицію на північний захід від населеного пункту Вербове, Запорізька область.Location: NW of Verbove, Zaporizhia Oblast, Ukraine47.447232, 35.919696Source:https://t.me/ZA_FROHT/21111"
23.08.2023 19:23:54 UTC+03:00,"47-ма окрема механізована бригада встановила прапор України в центрі населеного пункту Роботине, Запорізька область.Location: Robotyne, Zaporizhzhia Oblast, Ukraine47.443153, 35.835672Source:t.me/brygada47/97https://twitter.com/DefMon3/status/1691132354348175369"
23.08.2023 21:09:03 UTC+03:00,"Заявлено про падіння літака, в якому можливо знаходився Євгеній Прігожин та Дмитро Уткін на південь від населеного пункту Куженкінскоє, Тверська область.Location: S of Kuzhenkinskoye, Tver Oblast57.747663, 33.954326"
24.08.2023 11:05:52 UTC+03:00,"БМП ""Bradley"" проводить евакуацію українських військових під артилерійським обстрілом в південно східній частині Роботиного, Запорізька область.Location: Robotyne, Zaporizhzhia Oblast, Ukraine47.444020, 35.839483Source:t.me/wargonzo/14571"
24.08.2023 14:19:24 UTC+03:00,"126-та бригада ТрО ФПВ дроном атакує ЗРГК ""Тунгуска"" на південний схід від населеного пункту Підстепне, Херсонська область.Location: SE of Pidstepne, Kherson Oblast, Ukraine46.642304, 32.913256Source:https://twitter.com/sternenko/status/1694648401055375749"
24.08.2023 18:04:59 UTC+03:00,"Батальйон ""Скала"" бере полонених та штурмує російські позиції в південній частині Роботиного, Запорізька область.Location: Robotyne, Zaporizhzhia Oblast, Ukraine47.439890, 35.840240Source:https://t.me/c/1534945236/16478"
24.08.2023 21:54:14 UTC+03:00,"Росіяни публікують архівні кадри обстрілу ""Металургійного комбінату імені Ілліча"" прямою наводкою з БМ-21 ""Град"" в Маріуполі, Донецька область.Location: Mariupol, Donetsk Oblast, Ukraine47.174309, 37.567166Source:https://t.me/dugout_uncle_zhora/220"
25.08.2023 12:19:39 UTC+03:00,"Заявлено про знищення з ПТРК БМП ""M2 Bradley"" в центральній частині Роботиного, Запорізька область.Location: Robotyne, Zaporizhzhia Oblast, Ukraine47.446188, 35.838239https://t.me/rusich_army/10540"
25.08.2023 13:26:36 UTC+03:00,https://vxtwitter.com/Bazinga00264477/status/1695014546203623452
