Date Text,Text Text,location,oblast,date,time,timezone,Year,Month,Day,Season,AM_PM
01.10.2023 13:40:23 UTC+03:00,"11-та бригади НГУ ФПВ дронами знищує російську МТ-ЛБ з установкою А-22 «Огонь» на північний захід від населеного пункту Підстепне, Херсонська область.Location: NW of Pidstepne, Kherson Oblast46.671064, 32.872504Source:https://t.me/ssternenko/21076",nw of pidstepne - kherson oblast. - .source:https://t.me/ssternenko/,kherson,2023-10-01,10:40:23,2023-10-01 13:40:23,2023,10,1,Fall,AM
01.10.2023 18:59:50 UTC+03:00,"Російська авіація наносить авіаудари по українським позиціям з застосуванням УМПК в населеному пункті Вишневе, Харківська область.Location: Vyshneve, Kharkiv Oblast, Ukraine49.405226, 37.86118649.402501, 37.863482Source:https://t.me/bortzhyrnal/157",vyshneve - kharkiv oblast - ukraine.,kharkiv,2023-10-01,15:59:50,2023-10-01 18:59:50,2023,10,1,Fall,PM
01.10.2023 21:15:15 UTC+03:00,"Заявлено про знищення ворожих БМП касетними боєприпасами на південний схід від населеного пункту Копані, Запорізька область.Location: SE of Kopani, Zaporizhzhia Oblast, Ukraine47.434971, 35.763265Source:https://t.me/immateriumukrkhorne/756",se of kopani - zaporizhzhia oblast - ukraine.,zaporizhzhia,2023-10-01,18:15:15,2023-10-01 21:15:15,2023,10,1,Fall,PM
01.10.2023 22:57:22 UTC+03:00,"Українське видання ""Думская"" публікує ексклюзивні кадри обстрілу росіянами корабельною артилерією південної частини Одеси. Архівні кадри.Location: Odesa, Odesa Oblast, Ukraine46.367938, 30.728197Source:https://t.me/OdessaDumskayaNet/64524",odesa - odesa oblast - ukraine.,odesa,2023-10-01,19:57:22,2023-10-01 22:57:22,2023,10,1,Fall,PM
02.10.2023 13:04:30 UTC+03:00,"Підрозділ ""Shadow"" ФПВ дроном уражає російську гармату М-12 ""Рапіра"" на північний схід від населеного пункту Старомлинівка, Донецька область.Location: NE of Staromlynivka, Donetsk Oblast, Ukraine47.706744, 36.865739Source:https://t.me/pidrozdilshadowoficial/87",ne of staromlynivka - donetsk oblast - ukraine.,donetsk,2023-10-02,10:04:30,2023-10-02 13:04:30,2023,10,2,Fall,AM
02.10.2023 21:53:52 UTC+03:00,"Підрозділ ""Зайчики Черкеса"" 1-ї бригади оперативного призначення ФПВ дронами роблять скид на російськи позиції в населеному пункті Джерельне, Луганська область.Location: Dzherelne, Luhansk Oblast, Ukraine49.413599, 37.953255Source:https://t.me/ngu_war_for_peace/13172",dzherelne - luhansk oblast - ukraine.,luhansk,2023-10-02,18:53:52,2023-10-02 21:53:52,2023,10,2,Fall,PM
03.10.2023 10:45:07 UTC+03:00,"Бригада ""Сталевий Кордон"" ФПВ дроном атакує російську вантажівку в населеному пункті Долгоє, Бєлгородська область.Location: Dolhoe, Belgorod Oblast, Russia50.089427, 37.905035Source:https://t.me/DPSUkr/14379",dolhoe - belgorod oblast - russia.,belgorod,2023-10-03,07:45:07,2023-10-03 10:45:07,2023,10,3,Fall,AM
03.10.2023 11:20:53 UTC+03:00,"67-ма окрема механізована бригада обстрілює російські позиції на південь від населеного пункту Кузьмине, Луганська область.Location: S of Kuzmine, Luhansk Oblast, Ukraine0:12-0:30 -48.974879, 38.140157Source:https://t.me/duk67ombr/440",s of kuzmine - luhansk oblast - ukraine:-: -.,luhansk,2023-10-03,08:20:53,2023-10-03 11:20:53,2023,10,3,Fall,AM
03.10.2023 12:44:58 UTC+03:00,"Ударна рота БПЛА 24-ї ОМБр «Рарог» скидами знищує росіян на захід від населеного пункту Зайцеве, Донецька область.Location: Zaitseve, Svitlodarsk urban hromada, Donetsk Oblast, Ukraine48.420684, 37.961371Source:https://t.me/Rarog_24OMBr/79",zaitseve - svitlodarsk urban hromada - donetsk oblast,donetsk,2023-10-03,09:44:58,2023-10-03 12:44:58,2023,10,3,Fall,AM
03.10.2023 16:24:42 UTC+03:00,"72-га окрема механізована бригада ФПВ дроном атакує російський міномет на південний захід від населеного пункту Микільське, Донецька область.Location: SW of Mykilske, Donetsk Oblast, Ukraine47.738034, 37.286094Source:https://t.me/toro_ua/157",sw of mykilske - donetsk oblast - ukraine.,donetsk,2023-10-03,13:24:42,2023-10-03 16:24:42,2023,10,3,Fall,PM
03.10.2023 19:33:37 UTC+03:00,"Дрон з тепловізором коригує обстріл українських позицій на захід від населеного пункту Зайцеве, Донецька область.Location: W of Zaitseve, Svitlodarsk urban hromada, Donetsk Oblast, Ukraine48.427268, 37.946835Source:https://t.me/rusich_army/11139",w of zaitseve - svitlodarsk urban hromada - donetsk oblast,donetsk,2023-10-03,16:33:37,2023-10-03 19:33:37,2023,10,3,Fall,PM
03.10.2023 20:50:48 UTC+03:00,"Снайперська група «Привид» Окремої президентської бригади демонструє свою роботу по цілям в Бахмуті, Донецька область. Заявлено про роботу з BARRET MRAD 338Location: Bakhmut, Donetsk Oblast, Ukraine~48.591320,37.956855Source:https://t.me/osirskiy/372",bakhmut - donetsk oblast - ukraine~.,donetsk,2023-10-03,17:50:48,2023-10-03 20:50:48,2023,10,3,Fall,PM
03.10.2023 21:44:00 UTC+03:00,"Підрозділ ""М2"" ФПВ дроном знищує російський БМ-21 ""Град"" в населеному пункті Зайцеве, Донецька область.Location: Zaitseve, Bakhmut urban hromada, Donetsk Oblast, Ukraine48.524672, 38.077959Source:https://t.me/escadrone/697",zaitseve - bakhmut urban hromada - donetsk oblast,donetsk,2023-10-03,18:44:00,2023-10-03 21:44:00,2023,10,3,Fall,PM
03.10.2023 23:46:36 UTC+03:00,"Підрозділ “Sky Lords” ФПВ дроном (ID: Sky Lordss) атакує російські позиції поблизу населеного пункту Горьківський, Бєлгородська область.Location: Gor'kovskii, Belgorod Oblast, Ukraine50.439942, 35.846294Source:t.me/skylordss/97",gor'kovskii - belgorod oblast - ukraine.,belgorod,2023-10-03,20:46:36,2023-10-03 23:46:36,2023,10,3,Fall,PM
04.10.2023 12:19:05 UTC+03:00,"Застосування керованої ракети ""LMUR"" по українським позиціям в населеному пункті Новомихайлівка, Донецька область.Location: Novomykhailivka, Donetsk Oblast, Ukraine47.860536, 37.500343Source:https://t.me/voin_dv/5291",novomykhailivka - donetsk oblast - ukraine.,donetsk,2023-10-04,09:19:05,2023-10-04 12:19:05,2023,10,4,Fall,AM
04.10.2023 14:02:06 UTC+03:00,"Заявлено про знищення САУ ""Цезарь"" на північний захід від населеного пункту Шестерівка, Харківська область.Location: NW of Shesterivka, Kharkiv Oblast, Ukraine50.193535, 36.907957Source:https://t.me/vysokygovorit/13004",nw of shesterivka - kharkiv oblast - ukraine.,kharkiv,2023-10-04,11:02:06,2023-10-04 14:02:06,2023,10,4,Fall,AM
04.10.2023 15:13:57 UTC+03:00,"108-ма окрема бригада територіальної оборони обстрілює російські позиції в населеному пункті Інженерне, Запорізька область.Location: Inzhenerne, Zaporizhzhia oblast, Ukraine47.496106, 36.103212Source:https://t.me/AFUStratCom/20345",inzhenerne - zaporizhzhia oblast - ukraine.,zaporizhzhia,2023-10-04,12:13:57,2023-10-04 15:13:57,2023,10,4,Fall,PM
04.10.2023 21:15:21 UTC+03:00,"Підрозділ ""Гаруда"" 46-ї ОАеМБр ФПВ дронами атакує російську позицію в населеному пункті Новопрокопівка, Запорізька область.Location: Novoprokopivka, Zaporizhzhia Oblast, Ukraine2:04-2:14 -47.408633, 35.860309Source:https://t.me/BaluHUB/4885",novoprokopivka - zaporizhzhia oblast - ukraine:-: -.,zaporizhzhia,2023-10-04,18:15:21,2023-10-04 21:15:21,2023,10,4,Fall,PM
04.10.2023 22:24:19 UTC+03:00,"Підрозділ ""Shadow"" коригує знищення HIMARSом двох установок розмінування ""УР-77"" поблизу населеного пункту Березове, Донецька область.Location: near Berezove, Donetsk Oblast, Ukraine47.761315, 37.588342Source:https://t.me/pidrozdilshadowoficial/94",near berezove - donetsk oblast - ukraine.,donetsk,2023-10-04,19:24:19,2023-10-04 22:24:19,2023,10,4,Fall,PM
05.10.2023 00:38:59 UTC+03:00,"Підрозділ ""Гаруда"" 46-ї ОАеМБр ФПВ дронами атакує квадроцикл та живу силу росіян поблизу Новопрокопівки, Запорізька область.Location: NE of Novoprokopivka, Zaporizhzhia Oblast, Ukraine0:17 -47.413997, 35.8539271:09 -47.413733, 35.854087Source:t.me/BaluHUB/4885",ne of novoprokopivka - zaporizhzhia oblast - ukraine: -.,zaporizhzhia,2023-10-04,21:38:59,2023-10-05 00:38:59,2023,10,4,Fall,PM
05.10.2023 14:55:32 UTC+03:00,"ТОС-1А обстрілює українські позиції на північний захід від Лиману Першого, Харківська область.Location: NW of Lyman Pershyi, Kharkiv Oblast, Ukraine0:35 -49.805756,37.6821240:46 -49.797639,37.676119Source:https://t.me/mod_russia/31157",nw of lyman pershyi - kharkiv oblast - ukraine: -.,kharkiv,2023-10-05,11:55:32,2023-10-05 14:55:32,2023,10,5,Fall,AM
05.10.2023 16:29:08 UTC+03:00,"РУБпАК 110-ї ОМБр ФПВ дроном знищує ""Буханку"" на південний схід від Авдіївки, Донецька область.Location: SE of Avdiivka, Donetsk Oblast, Ukraine48.102796, 37.792955Source:https://t.me/rubpak/19",se of avdiivka - donetsk oblast - ukraine.,donetsk,2023-10-05,13:29:08,2023-10-05 16:29:08,2023,10,5,Fall,PM
05.10.2023 17:31:19 UTC+03:00,"79-та окрема десантно-штурмова бригада ФПВ дроном атакує російський БТР в населеному пункті Солодке, Донецька область.Location: Solodke, Donetsk Oblast, Ukraine47.791927, 37.492943Source:https://t.me/toro_ua/162",solodke - donetsk oblast - ukraine.,donetsk,2023-10-05,14:31:19,2023-10-05 17:31:19,2023,10,5,Fall,PM
05.10.2023 17:46:29 UTC+03:00,"Заявлено як удар по українським військовим на захід від населеного пункту Кучерів Яр, Донецька область.Location: W of Kucheriv Yar, Donetsk Oblast, Ukraine48.503691, 37.246684Source:https://t.me/milinfolive/107590",w of kucheriv yar - donetsk oblast - ukraine.,donetsk,2023-10-05,14:46:29,2023-10-05 17:46:29,2023,10,5,Fall,PM
05.10.2023 23:16:12 UTC+03:00,"Бійці 12-ї бригади спеціального призначення НГУ «Азов» ФПВ дронами атакують засоби спостереження, живу силу та техніку росіян.Location:S of Pryvillia, Luhansk Oblast, Ukraine0:01-0:05 -48.979788,38.298840Kreminna, Luhansk Oblast, Ukraine0:09-0:14 -49.041449,38.253473Pryvillia, Luhansk Oblast, Ukraine0:17-0:20, 0:44-0:47, 0:48-0:53 -48.996383, 38.286192S of Pryvillia, Luhansk Oblast, Ukraine0:23-0:26 -48.979813, 38.298774Pryvillia, Luhansk Oblast, Ukraine0:34-0:36 -48.999657, 38.284571Pryvillia, Luhansk Oblast, Ukraine1:09-1:13 -48.999345, 38.284537Source:https://t.me/azov_media/5057",s of pryvillia - luhansk oblast - ukraine:-: -.,luhansk,2023-10-05,20:16:12,2023-10-05 23:16:12,2023,10,5,Fall,PM
06.10.2023 10:42:10 UTC+03:00,"72-га ОМБр ФПВ дронами атакує російський танк в населеному пункті Єгорівка, Донецька область.Location: Yehorivka, Donetsk Oblast, Ukraine0:01 -47.708176, 37.2404120:34 -47.702065, 37.228670Source:https://t.me/toro_ua/163",yehorivka - donetsk oblast - ukraine: -.,donetsk,2023-10-06,07:42:10,2023-10-06 10:42:10,2023,10,6,Fall,AM
06.10.2023 12:38:12 UTC+03:00,"Ударна рота БПЛА 24-ї ОМБр «Рарог» скидом знищує російську ""Буханку"" в населеному пункті Зайцеве, Донецька область.Location: Zaitseve, Svitlodarsk urban hromada, Donetsk Oblast, Ukraine48.427788, 37.999278Source:https://t.me/Rarog_24OMBr/81",zaitseve - svitlodarsk urban hromada - donetsk oblast,donetsk,2023-10-06,09:38:12,2023-10-06 12:38:12,2023,10,6,Fall,AM
06.10.2023 18:02:11 UTC+03:00,"Підрозділ ""12 друзів Оушена"" ФПВ дроном влучають в російську САУ 2С40 ""Флокс"" на південний схід від населеного пункту Пойма, Херсонська область.Location: SE of Poima, Kherson Oblast, Ukraine46.609169, 32.852078Source:https://t.me/ssternenko/21245",se of poima - kherson oblast - ukraine.,kherson,2023-10-06,15:02:11,2023-10-06 18:02:11,2023,10,6,Fall,PM
07.10.2023 13:51:36 UTC+03:00,"Хамас скидом знищує ізраїльський танк Меркава 4 на південний схід від населеного пункту Бурейдж, Сектор Газа.Location: SE of Bureij, Gaza Strip31.432081, 34.433927Source:https://twitter.com/NOELreports/status/1710592497200648501",se of bureij - gaza strip. - .source:https://twitter.com/noelreports/status/,,2023-10-07,10:51:36,2023-10-07 13:51:36,2023,10,7,Fall,AM
07.10.2023 16:50:10 UTC+03:00,"Дрон ""Хамаса"" робить скид на ізраїльських військових на північний схід від населеного пункту Нахаль-Оз, Ізраїль.Location: NE of Nahal Oz, Israel31.480096, 34.501139Source:https://twitter.com/WarMonitors/status/1710612233829359851",ne of nahal oz - israel. - .source:https://twitter.com/warmonitors/status/,,2023-10-07,13:50:10,2023-10-07 16:50:10,2023,10,7,Fall,PM
07.10.2023 17:07:02 UTC+03:00,"Бригада ""Аль-Кудс"" демонструє захоплену ізраїльську базу на північний схід від населеного пункту Нахаль-Оз, Ізраїль.Location: NE of Nahal Oz, Israel31.478890, 34.500219Source:https://t.me/sarayaps/16170",ne of nahal oz - israel. - .source:https://t.me/sarayaps/,,2023-10-07,14:07:02,2023-10-07 17:07:02,2023,10,7,Fall,PM
07.10.2023 22:05:59 UTC+03:00,"""Шершні Довбуша"" 68-ї ОЄБр скидом влучають в російського військового в населеному пункті Райгородка, Луганська область.Location: Raihorodka, Luhansk Oblast, Ukraine49.366840, 37.968994Source:https://t.me/shershni68/99",raihorodka - luhansk oblast - ukraine.,luhansk,2023-10-07,19:05:59,2023-10-07 22:05:59,2023,10,7,Fall,PM
07.10.2023 22:30:34 UTC+03:00,"Аеророзвідка 129-ї ОБРТрО та 44 ОАБр знищують російський БМ-27 ""Ураган"" на північний схід від населеного пункту Орлинське, Донецька область.Location: NE of Orlynske, Donetsk Oblast, Ukraine47.665303, 36.772127Source:https://t.me/kolesnyknews/226",ne of orlynske - donetsk oblast - ukraine.,donetsk,2023-10-07,19:30:34,2023-10-07 22:30:34,2023,10,7,Fall,PM
08.10.2023 13:08:00 UTC+03:00,"Бригади ""Аль-Кассама"" захоплюють ізраїльську базу на південний захід від населеного пункту Рейм, Ізраїль.Location: SW of Re'im, Israel0:19-0:29 -31.363734, 34.448074Source:https://t.me/jeninqassam/62190",sw of re'im - israel:-: -. - .source:https://t.me/jeninqassam/,,2023-10-08,10:08:00,2023-10-08 13:08:00,2023,10,8,Fall,AM
08.10.2023 20:00:18 UTC+03:00,"Бригади ""Аль-Кассама"" скидом знищують вогневу точку ізраїльської армії на схід від населеного пункту Ас-Сіафа, Сектор Гази.Location: E of As-Siafa, Gaza Strip0:20-0:27 -31.586644, 34.505412Source:https://t.me/qassambrigades/28399",e of as-siafa - gaza strip:-: -. - .source:https://t.me/qassambrigades/,,2023-10-08,17:00:18,2023-10-08 20:00:18,2023,10,8,Fall,PM
08.10.2023 20:48:27 UTC+03:00,"Знищена російська САУ 2С19 ""Мста-С"", яку намагалися сховати під мостом на південь від Донецька.Location: S of Donetsk, Donetsk Oblast, Ukraine47.918483, 37.73303Source:https://t.me/russianocontext/775",s of donetsk - donetsk oblast - ukraine.,donetsk,2023-10-08,17:48:27,2023-10-08 20:48:27,2023,10,8,Fall,PM
08.10.2023 21:41:20 UTC+03:00,"Хамас демонструє відео обстрілу Ізраїлю та політ десанту бригад ""Аль-Кассам"" на схід від населеного пункту Бейт-Лахія, Сектор Гази.Location: E of Beit Lahia, Gaza Strip31.557153, 34.530681Source:https://t.me/qassambrigades/28399",e of beit lahia - gaza strip. - .source:https://t.me/qassambrigades/,,2023-10-08,18:41:20,2023-10-08 21:41:20,2023,10,8,Fall,PM
09.10.2023 00:05:35 UTC+03:00,"Десятки літаків Повітряних сил Ізраїлю наносять удари по 150 цілям в районі Шеджайя, Газа.Location: Shejaiya, Gaza City, Gaza Strip31.489932, 34.478679Source:https://twitter.com/IAFsite/status/1711102411706626386",shejaiya - gaza city - gaza strip.,,2023-10-08,21:05:35,2023-10-09 00:05:35,2023,10,8,Fall,PM
09.10.2023 18:50:10 UTC+03:00,"Повітряні сили Ізраїлю бомбардують район Аль-Ататра, місто Бейт-Лахія, Сектор Гази.Location: Al-Atatra neighourhood, Beit Lahia, Gaza Strip31.561606, 34.478868Source:https://t.me/israeli_air_force/4119",al-atatra neighourhood - beit lahia - gaza strip.,,2023-10-09,15:50:10,2023-10-09 18:50:10,2023,10,9,Fall,PM
09.10.2023 19:40:38 UTC+03:00,"Повітряні сили Ізраїлю завдають удару по ворожим позиціям на схід від населеного пункту Марвахін, Ліван.Location: E of Marwahin, South Governorate, Lebanon33.110853, 35.284219Source:https://twitter.com/ELINTNews/status/1711370618073915513",e of marwahin - south governorate - lebanon.,,2023-10-09,16:40:38,2023-10-09 19:40:38,2023,10,9,Fall,PM
09.10.2023 20:21:01 UTC+03:00,"Кадри захоплення військової бази ""Фаджа"" бригадами ""Аль-Кассама"" та вбивства ізраїльських військових на схід від населеного пункту Джугор ад-Дік, сектор Гази.Location: E of Juhor ad Dik, Gaza Strip31.451370, 34.468934Source:https://t.me/qassambrigades/28424",e of juhor ad dik - gaza strip. - .source:https://t.me/qassambrigades/,,2023-10-09,17:21:01,2023-10-09 20:21:01,2023,10,9,Fall,PM
09.10.2023 20:56:20 UTC+03:00,"109-й батальйон 10-ї ОГШБр знищує групу росіян на захід від населеного пункту Берестове, Донецька область.Location: W of Berestove, Donetsk Oblast, Ukraine48.757505, 38.195708Source:https://t.me/AFUStratCom/20436",w of berestove - donetsk oblast - ukraine.,donetsk,2023-10-09,17:56:20,2023-10-09 20:56:20,2023,10,9,Fall,PM
09.10.2023 23:41:45 UTC+03:00,"Масовані ізраїльські бомбардування в західній частині міста Газа, Сектор Гази.Location: Gaza City, Gaza StripPov:31.517488, 34.447631Source:https://twitter.com/Osinttechnical/status/1711404248427102488",gaza city - gaza strippov:. - .source:https://twitter.com/osinttechnical/status/,,2023-10-09,20:41:45,2023-10-09 23:41:45,2023,10,9,Fall,PM
10.10.2023 01:13:52 UTC+03:00,"Знищена будівля ""Аль-Бідрісаві"" після ізраїльських бомбардувань на півночі міста Газа, Сектор Гази.Location: Gaza City, Gaza Strip31.523309, 34.445094Source:https://twitter.com/DD_Geopolitics/status/1711498077700493487",gaza city - gaza strip. - .source:https://twitter.com/dd_geopolitics/status/,,2023-10-09,22:13:52,2023-10-10 01:13:52,2023,10,9,Fall,PM
10.10.2023 17:35:37 UTC+03:00,"Ізраїльські бомбардування в районі контрольно-пропускного пункту Рафах, що на кордоні з Єгиптом.Location: Rafah Border Crossing, Rafah, Gaza StripPov:31.251480, 34.262103Source:https://t.me/ShehabTelegram/401074",rafah border crossing - rafah - gaza strippov:.,,2023-10-10,14:35:37,2023-10-10 17:35:37,2023,10,10,Fall,PM
10.10.2023 17:55:14 UTC+03:00,"Батальйон ""Пятнашка"" обмінює двох українських полонених на одне тіло російського військового поблизу Авдіївки, Донецька область.Location: near Avdiivka, Donetsk Oblast, Ukraine48.128556, 37.805077Source:https://t.me/ttambyl/3504",near avdiivka - donetsk oblast - ukraine.,donetsk,2023-10-10,14:55:14,2023-10-10 17:55:14,2023,10,10,Fall,PM
10.10.2023 20:54:29 UTC+03:00,"110-та ОМБр знищує російську БМП на північний схід від населеного пункту Красногорівка, Донецька область.Location: NE of Krasnohorivka, Pokrovsk Raion, Donetsk Oblast, Ukraine48.228539, 37.745930Source:https://twitter.com/GloOouD/status/1711777462214967533",ne of krasnohorivka - pokrovsk raion - donetsk oblast,donetsk,2023-10-10,17:54:29,2023-10-10 20:54:29,2023,10,10,Fall,PM
10.10.2023 21:26:30 UTC+03:00,"Himars знищує російську САУ та склад з бк на захід від Новомикільського та в Мілуватій, Луганська область.Location: W of Novomykilske/Miluvata, Luhansk Oblast, Ukraine0:01 -49.295066, 38.1392310:35 -49.341533, 38.146571Source:https://twitter.com/nevedimka123/status/1711752395489694120",w of novomykilske/miluvata - luhansk oblast - ukraine: -.,luhansk,2023-10-10,18:26:30,2023-10-10 21:26:30,2023,10,10,Fall,PM
10.10.2023 22:44:39 UTC+03:00,"Ізраїльські військові демонструють вбитих бійців ""Хамас"" на південний захід від населеного пункту Зікім, Ізраїль.Location: SW of Zikim, Israel31.597080, 34.497043Source:https://twitter.com/markito0171/status/1711820250163867989",sw of zikim - israel. - .source:https://twitter.com/markito/status/,,2023-10-10,19:44:39,2023-10-10 22:44:39,2023,10,10,Fall,PM
10.10.2023 23:08:17 UTC+03:00,"Тепер вже ізраїльська сторона демонструє удар по контрольно-пропускному пункту Рафах, що на кордоні з Єгиптом.Location: Rafah Border Crossing, Rafah, Gaza Strip0:10-0:16 -31.248635, 34.257464Source:https://twitter.com/astraiaintel/status/1711723154761035827",rafah border crossing - rafah - gaza strip:-: -.,,2023-10-10,20:08:17,2023-10-10 23:08:17,2023,10,10,Fall,PM
10.10.2023 23:24:56 UTC+03:00,"БПЛА ""Ланцет"" знищує український Су-25 на аеродромі в Кривому Розі, Дніпропетровська область.Location: Kryvyi Rih, Dnipropetrovsk Oblast, Ukraine47.889236, 33.530861Source:https://t.me/RtrDonetsk/20832",kryvyi rih - dnipropetrovsk oblast - ukraine.,dnipropetrovsk,2023-10-10,20:24:56,2023-10-10 23:24:56,2023,10,10,Fall,PM
11.10.2023 00:31:37 UTC+03:00,"Хезболла знищує ізраїльську М113 з ПТРК ""Корнет"" на північний захід від населеного пункту Ір'он, Ізраїль.Location: NW of Yir'on, Galilee Panhandle, Israel33.085820, 35.448216Source:https://t.me/C_Military1/36690",nw of yir'on - galilee panhandle - israel.,,2023-10-10,21:31:37,2023-10-11 00:31:37,2023,10,10,Fall,PM
11.10.2023 13:02:59 UTC+03:00,"Ізраїльські авіабомбардування довкола населеного пункту Дхайра, ЛіванLocation: Dhayra, South Governorate, Lebanon33.101655, 35.225587Source:https://twitter.com/WarMonitors/status/1712027347279344088",dhayra - south governorate - lebanon.,,2023-10-11,10:02:59,2023-10-11 13:02:59,2023,10,11,Fall,AM
