Date Text,Text Text
05.10.2023 17:46:29 UTC+03:00,"Заявлено як удар по українським військовим на захід від населеного пункту Кучерів Яр, Донецька область.Location: W of Kucheriv Yar, Donetsk Oblast, Ukraine48.503691, 37.246684Source:https://t.me/milinfolive/107590"
05.10.2023 23:16:12 UTC+03:00,"Бійці 12-ї бригади спеціального призначення НГУ «Азов» ФПВ дронами атакують засоби спостереження, живу силу та техніку росіян.Location:S of Pryvillia, Luhansk Oblast, Ukraine0:01-0:05 -48.979788,38.298840Kreminna, Luhansk Oblast, Ukraine0:09-0:14 -49.041449,38.253473Pryvillia, Luhansk Oblast, Ukraine0:17-0:20, 0:44-0:47, 0:48-0:53 -48.996383, 38.286192S of Pryvillia, Luhansk Oblast, Ukraine0:23-0:26 -48.979813, 38.298774Pryvillia, Luhansk Oblast, Ukraine0:34-0:36 -48.999657, 38.284571Pryvillia, Luhansk Oblast, Ukraine1:09-1:13 -48.999345, 38.284537Source:https://t.me/azov_media/5057"
06.10.2023 10:42:10 UTC+03:00,"72-га ОМБр ФПВ дронами атакує російський танк в населеному пункті Єгорівка, Донецька область.Location: Yehorivka, Donetsk Oblast, Ukraine0:01 -47.708176, 37.2404120:34 -47.702065, 37.228670Source:https://t.me/toro_ua/163"
06.10.2023 12:38:12 UTC+03:00,"Ударна рота БПЛА 24-ї ОМБр «Рарог» скидом знищує російську ""Буханку"" в населеному пункті Зайцеве, Донецька область.Location: Zaitseve, Svitlodarsk urban hromada, Donetsk Oblast, Ukraine48.427788, 37.999278Source:https://t.me/Rarog_24OMBr/81"
06.10.2023 18:02:11 UTC+03:00,"Підрозділ ""12 друзів Оушена"" ФПВ дроном влучають в російську САУ 2С40 ""Флокс"" на південний схід від населеного пункту Пойма, Херсонська область.Location: SE of Poima, Kherson Oblast, Ukraine46.609169, 32.852078Source:https://t.me/ssternenko/21245"
07.10.2023 13:51:36 UTC+03:00,"Хамас скидом знищує ізраїльський танк Меркава 4 на південний схід від населеного пункту Бурейдж, Сектор Газа.Location: SE of Bureij, Gaza Strip31.432081, 34.433927Source:https://twitter.com/NOELreports/status/1710592497200648501"
07.10.2023 16:50:10 UTC+03:00,"Дрон ""Хамаса"" робить скид на ізраїльських військових на північний схід від населеного пункту Нахаль-Оз, Ізраїль.Location: NE of Nahal Oz, Israel31.480096, 34.501139Source:https://twitter.com/WarMonitors/status/1710612233829359851"
07.10.2023 17:07:02 UTC+03:00,"Бригада ""Аль-Кудс"" демонструє захоплену ізраїльську базу на північний схід від населеного пункту Нахаль-Оз, Ізраїль.Location: NE of Nahal Oz, Israel31.478890, 34.500219Source:https://t.me/sarayaps/16170"
07.10.2023 22:05:59 UTC+03:00,"""Шершні Довбуша"" 68-ї ОЄБр скидом влучають в російського військового в населеному пункті Райгородка, Луганська область.Location: Raihorodka, Luhansk Oblast, Ukraine49.366840, 37.968994Source:https://t.me/shershni68/99"
07.10.2023 22:30:34 UTC+03:00,"Аеророзвідка 129-ї ОБРТрО та 44 ОАБр знищують російський БМ-27 ""Ураган"" на північний схід від населеного пункту Орлинське, Донецька область.Location: NE of Orlynske, Donetsk Oblast, Ukraine47.665303, 36.772127Source:https://t.me/kolesnyknews/226"
08.10.2023 13:08:00 UTC+03:00,"Бригади ""Аль-Кассама"" захоплюють ізраїльську базу на південний захід від населеного пункту Рейм, Ізраїль.Location: SW of Re'im, Israel0:19-0:29 -31.363734, 34.448074Source:https://t.me/jeninqassam/62190"
08.10.2023 20:00:18 UTC+03:00,"Бригади ""Аль-Кассама"" скидом знищують вогневу точку ізраїльської армії на схід від населеного пункту Ас-Сіафа, Сектор Гази.Location: E of As-Siafa, Gaza Strip0:20-0:27 -31.586644, 34.505412Source:https://t.me/qassambrigades/28399"
08.10.2023 20:48:27 UTC+03:00,"Знищена російська САУ 2С19 ""Мста-С"", яку намагалися сховати під мостом на південь від Донецька.Location: S of Donetsk, Donetsk Oblast, Ukraine47.918483, 37.73303Source:https://t.me/russianocontext/775"
08.10.2023 21:41:20 UTC+03:00,"Хамас демонструє відео обстрілу Ізраїлю та політ десанту бригад ""Аль-Кассам"" на схід від населеного пункту Бейт-Лахія, Сектор Гази.Location: E of Beit Lahia, Gaza Strip31.557153, 34.530681Source:https://t.me/qassambrigades/28399"
09.10.2023 00:05:35 UTC+03:00,"Десятки літаків Повітряних сил Ізраїлю наносять удари по 150 цілям в районі Шеджайя, Газа.Location: Shejaiya, Gaza City, Gaza Strip31.489932, 34.478679Source:https://twitter.com/IAFsite/status/1711102411706626386"
09.10.2023 18:50:10 UTC+03:00,"Повітряні сили Ізраїлю бомбардують район Аль-Ататра, місто Бейт-Лахія, Сектор Гази.Location: Al-Atatra neighourhood, Beit Lahia, Gaza Strip31.561606, 34.478868Source:https://t.me/israeli_air_force/4119"
09.10.2023 19:40:38 UTC+03:00,"Повітряні сили Ізраїлю завдають удару по ворожим позиціям на схід від населеного пункту Марвахін, Ліван.Location: E of Marwahin, South Governorate, Lebanon33.110853, 35.284219Source:https://twitter.com/ELINTNews/status/1711370618073915513"
09.10.2023 20:21:01 UTC+03:00,"Кадри захоплення військової бази ""Фаджа"" бригадами ""Аль-Кассама"" та вбивства ізраїльських військових на схід від населеного пункту Джугор ад-Дік, сектор Гази.Location: E of Juhor ad Dik, Gaza Strip31.451370, 34.468934Source:https://t.me/qassambrigades/28424"
09.10.2023 20:56:20 UTC+03:00,"109-й батальйон 10-ї ОГШБр знищує групу росіян на захід від населеного пункту Берестове, Донецька область.Location: W of Berestove, Donetsk Oblast, Ukraine48.757505, 38.195708Source:https://t.me/AFUStratCom/20436"
09.10.2023 23:41:45 UTC+03:00,"Масовані ізраїльські бомбардування в західній частині міста Газа, Сектор Гази.Location: Gaza City, Gaza StripPov:31.517488, 34.447631Source:https://twitter.com/Osinttechnical/status/1711404248427102488"
10.10.2023 01:13:52 UTC+03:00,"Знищена будівля ""Аль-Бідрісаві"" після ізраїльських бомбардувань на півночі міста Газа, Сектор Гази.Location: Gaza City, Gaza Strip31.523309, 34.445094Source:https://twitter.com/DD_Geopolitics/status/1711498077700493487"
10.10.2023 17:35:37 UTC+03:00,"Ізраїльські бомбардування в районі контрольно-пропускного пункту Рафах, що на кордоні з Єгиптом.Location: Rafah Border Crossing, Rafah, Gaza StripPov:31.251480, 34.262103Source:https://t.me/ShehabTelegram/401074"
10.10.2023 17:55:14 UTC+03:00,"Батальйон ""Пятнашка"" обмінює двох українських полонених на одне тіло російського військового поблизу Авдіївки, Донецька область.Location: near Avdiivka, Donetsk Oblast, Ukraine48.128556, 37.805077Source:https://t.me/ttambyl/3504"
10.10.2023 20:54:29 UTC+03:00,"110-та ОМБр знищує російську БМП на північний схід від населеного пункту Красногорівка, Донецька область.Location: NE of Krasnohorivka, Pokrovsk Raion, Donetsk Oblast, Ukraine48.228539, 37.745930Source:https://twitter.com/GloOouD/status/1711777462214967533"
10.10.2023 21:26:30 UTC+03:00,"Himars знищує російську САУ та склад з бк на захід від Новомикільського та в Мілуватій, Луганська область.Location: W of Novomykilske/Miluvata, Luhansk Oblast, Ukraine0:01 -49.295066, 38.1392310:35 -49.341533, 38.146571Source:https://twitter.com/nevedimka123/status/1711752395489694120"
10.10.2023 22:44:39 UTC+03:00,"Ізраїльські військові демонструють вбитих бійців ""Хамас"" на південний захід від населеного пункту Зікім, Ізраїль.Location: SW of Zikim, Israel31.597080, 34.497043Source:https://twitter.com/markito0171/status/1711820250163867989"
10.10.2023 23:08:17 UTC+03:00,"Тепер вже ізраїльська сторона демонструє удар по контрольно-пропускному пункту Рафах, що на кордоні з Єгиптом.Location: Rafah Border Crossing, Rafah, Gaza Strip0:10-0:16 -31.248635, 34.257464Source:https://twitter.com/astraiaintel/status/1711723154761035827"
10.10.2023 23:24:56 UTC+03:00,"БПЛА ""Ланцет"" знищує український Су-25 на аеродромі в Кривому Розі, Дніпропетровська область.Location: Kryvyi Rih, Dnipropetrovsk Oblast, Ukraine47.889236, 33.530861Source:https://t.me/RtrDonetsk/20832"
11.10.2023 00:31:37 UTC+03:00,"Хезболла знищує ізраїльську М113 з ПТРК ""Корнет"" на північний захід від населеного пункту Ір'он, Ізраїль.Location: NW of Yir'on, Galilee Panhandle, Israel33.085820, 35.448216Source:https://t.me/C_Military1/36690"
11.10.2023 13:02:59 UTC+03:00,"Ізраїльські авіабомбардування довкола населеного пункту Дхайра, ЛіванLocation: Dhayra, South Governorate, Lebanon33.101655, 35.225587Source:https://twitter.com/WarMonitors/status/1712027347279344088"
11.10.2023 17:37:39 UTC+03:00,"116-та бригада ТрО знищує російський танк та бтр(?) на захід від населеного пункту Красногорівка, Донецька область.Location: W of Krasnohorivka, Pokrovsk Raion, Donetsk Oblast, Ukraine48.208288, 37.690111Source:https://www.facebook.com/brygada.TrO.Poltava/videos/298928019599988/"
11.10.2023 18:02:30 UTC+03:00,"53-тя ОМБр обстрілює російський десант касетними боєприпасами на північний схід від населеного пункту Водяне, Донецька область. + додаткові відеоLocation: NE of Vodiane, Pokrovsk Raion, Donetsk Oblast, Ukraine48.111976, 37.677820Source:https://t.me/ukrbavovna/11066"
11.10.2023 19:28:24 UTC+03:00,"Жителі міста Ашкелон фільмують роботу системи ПРО ""Залізний Купол""Location: Ashkelon, Southern District, Israel31.691943, 34.585110Source:https://twitter.com/NOELreports/status/1711749072913375523"
11.10.2023 23:03:17 UTC+03:00,"РУБпАК 110-ОМБр ФПВ дроном влучає в російську МТЛБ поблизу населеного пункту Спартак, Донецька область.Location: near Spartak, Donetsk Oblast, Ukraine48.097606, 37.783401Source:https://t.me/rubpak/21"
12.10.2023 12:35:05 UTC+03:00,"Окремий загін спеціального призначення «Омега 5» ФПВ дроном атакує російську позицію поблизу населеного пункту Спартак, Донецька область.Location: near Spartak, Donetsk Oblast, Ukraine48.105013, 37.775909Source:https://t.me/omega_company3/3667"
12.10.2023 19:55:27 UTC+03:00,"Перестрілка ізраїльських військових та бійців ""Хамаса"" в населеному пункті Сдерот, Ізраїль. Архівні кадри.Location: Sderot, Southern District, IsraelPov:31.522647, 34.591296Source:https://t.me/Yediotnews/81263"
13.10.2023 14:27:55 UTC+03:00,"116-та бригада ТрО обстрілює дві російські БМП з десантом на північний схід від населеного пункту Степове, Донецька область.Location: NE of Stepove, Pokrovsk Raion, Donetsk Oblast, Ukraine48.202242, 37.689917Source:https://t.me/ukr_pics/16966"
13.10.2023 15:40:30 UTC+03:00,"РУБпАК «АХІЛЛЕС» 92-ї ОШБр ФПВ дронами знищує російську САУ ""Акація"", атакує ""Урал"" та БТР-80 в Бахмуті, Донецька область.Location: Bakhmut, Donetsk Oblast, Ukraine48.593351, 38.04355148.586764, 38.03291248.591598, 38.016683Source:https://t.me/fedorenkoys/136"
13.10.2023 16:53:07 UTC+03:00,"110-та ОМБр робить скид на російські позиції на північ від населеного пункту Красногорівка, Донецька область.Location: N of Krasnohorivka, Pokrovsk Raion, Donetsk Oblast, Ukraine0:05-0:06 -48.218042, 37.723545Source:https://t.me/BUAR110ombr/128"
13.10.2023 20:17:56 UTC+03:00,"Журналісти ""Reuters"" потрапили під ізраїльські бомбардування на схід від Aalma El Chaeb, Ліван. Один журналіст загинув, ще 5 отримали поранення.Location: Aalma El Chaeb, South Governorate, Lebanon33.101291, 35.198127Source:https://t.me/jeninqassam/64372"
13.10.2023 21:26:35 UTC+03:00,"Росіяни фільмують свою масовану атаку на Авдіївку з використанням великої кількості техніки. + додав фото та відео результату.Location: S of Krasnohorivka, Donetsk Oblast0:01 -48.197204,37.7280520:38 -48.193335,37.7261691:46 -48.190893,37.725168Source:https://t.me/RVvoenkor/54848"
14.10.2023 10:11:59 UTC+03:00,"БУАР 59-ї ОМПБр ФПВ дроном атакує російську БМП-1 в населеному пункті Піски, Донецька область.Location: Pisky, Donetsk Oblast, Ukraine48.066079, 37.655089Source:https://t.me/skylordss/101"
14.10.2023 12:36:23 UTC+03:00,"Робота російського ППО в населеному пункті Адлер, Краснодарський край.Location: Adler, Krasnodar Krai, RussiaPov:43.443696, 39.911732Source:https://t.me/operatyvnii/13286"
14.10.2023 14:49:53 UTC+03:00,"Знищений російський військовий 110-ю ОМБр на териконі поблизу Авдіївки, Донецька область.Location: near Avdiivka, Donetsk Oblast, Ukraine48.185577, 37.713435Source:https://twitter.com/GloOouD/status/1713147379514216600"
14.10.2023 18:21:11 UTC+03:00,"Знищений російський БТР-50, пошкоджений Т-64БВ та знищена піхота на південь від Красногорівки, Донецька область.Location: S of Krasnohorivka, Donetsk Oblast, Ukraine0:30/1:26 -48.191121, 37.725357Source:https://t.me/BUAR110ombr/130"
14.10.2023 19:23:04 UTC+03:00,"Підрозділ ""VORON 100"" ФПВ дроном атакує російський Т-72B3 Obr.2022 в населеному пункті Діброва, Луганська область.Location: Dibrova, Luhansk Oblast, Ukraine49.007615, 38.111716Source:https://t.me/Volyn100obrTrO/935"
14.10.2023 19:44:14 UTC+03:00,"Ізраїльські військові на моторних човнах знищують бійців ""ХАМАС"" на північний захід від населеного пункту Зікім, Ізраїль.Location: NW of Zikim, Israel31.624945, 34.499398Source:https://t.me/Yediotnews/81539"
15.10.2023 00:25:49 UTC+03:00,"Російська артилерія боєприпасом ""Краснополь"" знищує гаубицю М777 на південь від населеного пункту Сіверськ, Донецька область.Location: S of Siversk, Donetsk Oblast, Ukraine48.838466, 38.111701Source:https://t.me/btr80/11326"
15.10.2023 01:20:19 UTC+03:00,"Знищена та покинута російська бронетехніка на північний схід від населеного пункту Степове, Донецька область.Location: NE of Stepove, Pokrovsk Raion, Donetsk Oblast, Ukraine0:31- 0:38 -48.203853, 37.694580Source:https://t.me/BUAR110ombr/130"
15.10.2023 12:43:50 UTC+03:00,"СБУ робить скид на електропідстанцію в населеному пункті Красна Яруга, Бєлгородська область. Мер Красної Яруги заявляє, що роботи по відновленню продовжуються.Location: Krasnaya Yaruga, Belgorod Oblast, Russia50.784782, 35.661494Source:https://t.me/lachentyt/35269"
15.10.2023 16:10:25 UTC+03:00,"Міноборони рф демонструє відео роботи БМ-21 ""Град"" в населеному пункті Кремінна, Луганська область.Location: Kreminna, Luhansk Oblast, Ukraine49.027946, 38.177039Source:https://t.me/mod_russia/31383"
16.10.2023 11:40:44 UTC+03:00,"Свежее видео от военнослужащего ВС РФ с Авдеевского направления, Донецкая область.Много трупов и разбитой российской техники."
16.10.2023 19:51:53 UTC+03:00,"Підрозділ «ГРИФОН» 36-ї ОБрМП ФПВ дроном знищує ""Буханку"" в населеному пункті Пойма, Херсонська область.Location: Poima, Kherson Oblast, Ukraine46.643737, 32.81856046.643950, 32.815829Source:https://t.me/GRIFON501/134"
16.10.2023 23:49:42 UTC+03:00,"Підрозділ ""Ластівка"" 11-ї бригади НГУ ФПВ дроном знищує російську ""Буханку"" на південь від населеного пункту Пойма, Херсонська область.Location: S of Poima, Kherson Oblast, Ukraine46.608941, 32.834990Source:https://t.me/ssternenko/21596"
17.10.2023 02:02:28 UTC+03:00,"14 ГУ ДВКР СБУ працює ФПВ дронами по російській піхоті, позиціях, легкових машинах, РСЗВ та гаубицях в Херсонській області.Location: Kardashynka, Kherson Oblast, Ukraine0:02-0:22 -46.551500, 32.645392Location: Kardashynka, Kherson Oblast, Ukraine0:23-0:30 -46.567873, 32.634691Location: Oleshky, Kherson Oblast, Ukraine0:31-0:36 -46.623098, 32.717629Location: E of Pidlisne, Kherson Oblast, Ukraine0:37-0:44 -46.570798, 32.734425Location: Pidlisne, Kherson Oblast, Ukraine0:45-0:51 -46.576068, 32.704675Location: SE of Pidlisne, Kherson Oblast, Ukraine0:54-1:03 -46.562683, 32.724985Location: Kardashynka, Kherson Oblast, Ukraine1:05-1:11 -46.568155, 32.631353Location: Kardashynka, Kherson Oblast, Ukraine1:12-1:18 -46.560748, 32.615269Location: Oleshky, Kherson Oblast, Ukraine1:19-1:29 -46.622967, 32.716975Location: Oleshky, Kherson Oblast, Ukraine1:30-1:40 -46.623008, 32.72469Location: Kardashynka, Kherson Oblast, Ukraine1:51-2:06 -46.568932,32.635274Source:t.me/toro_ua/171"
17.10.2023 15:00:37 UTC+03:00,"Знищений російський танк Т-72 та піхота на схід від населеного пункту Іванівка, Харківська область.Location: E of Ivanivka, Kharkiv Oblast, Ukraine49.667198, 37.901929Source:https://t.me/khornegroup/848https://t.me/russianocontext/935"
17.10.2023 20:51:38 UTC+03:00,"12-та бригада спеціального призначення НГУ «Азов» артилерією знищує інженерну техніку противника (БАТ-2, маніпулятор та понтон)Location: W of Shypylivka, Luhansk Oblast, Ukraine0:01 -48.971900, 38.190659Location: W of Shypylivka, Luhansk Oblast, Ukraine0:36 -48.977269, 38.221673Location: NW of Bilohorivka, Luhansk Oblast, Ukraine0:46 -48.956022, 38.211187Source:t.me/azov_media/5077"
17.10.2023 22:21:31 UTC+03:00,"Росіяни демонструють перші кадри роботи ТОС-2 ""Тосочка"" в населеному пункті Кремінна, Луганська область.Location: Kreminna, Luhansk Oblast, Ukraine49.038123, 38.185804Source:https://t.me/rian_ru/218519"
18.10.2023 21:54:36 UTC+03:00,"Підрозділ ""Алькор"" 116-ї бригади ТрО робить скид на російські позиції на північний схід від населеного пункту Новомихайлівка, Донецька область.Location: NE of Novomykhailivka, Donetsk Oblast47.870257, 37.525774Soure:https://facebook.com/brygada.TrO.Poltava/videos/375028014855099/"
19.10.2023 15:32:18 UTC+03:00,"Бригада ""Сталевий Кордон"" з ПТРК ""Стугна"" атакує російські БМП в Райгородці, Луганська область.Location: Raihorodka, Luhansk Oblast, Ukraine49.373021, 37.97176449.370084, 37.977750Source:https://t.me/Klymenko_MVS/394"
19.10.2023 19:42:48 UTC+03:00,"54-та бригада (?) атакує російські позиції на захід від населеного пункту Орлянське, Харківська область.Location: W of Orlianske, Kharkiv Oblast, Ukraine49.684900, 37.892832Source:https://t.me/c/1308729127/3719"
20.10.2023 14:24:32 UTC+03:00,"59-та ОМПБр ФПВ дроном знищує російський ТОС-1А ""Сонцепек"" в населеному пункті Піски, Донецька область.Location: Pisky, Donetsk Oblast, Ukraine48.068141, 37.668215Source:https://t.me/ssternenko/21706"
20.10.2023 15:39:36 UTC+03:00,"25-та ОПДБр ФПВ дроном знищує російський танк (бмп) на схід від населеного пункту Райгородка, Луганська область.Location: E of Raihorodka, Luhansk Oblast, Ukraine49.371467, 37.994910Source:https://t.me/c/1308729127/3738"
20.10.2023 17:41:48 UTC+03:00,"Наслідки удару по російській базі HIMARSом в населеному пункті Сватове, Луганська область.Location: Svatove, Luhansk Oblast, Ukraine49.396675, 38.179683Source:https://t.me/russianocontext/962"
20.10.2023 23:46:15 UTC+03:00,"13 ГУ ДВКР СБУ ФПВ дроном влучає в російську вантажівку в населеному пункті Ожерельне, Запорізька область.Location: Ozherelne, Zaporizhzhia Oblast, Ukraine47.446562, 36.179840Source:https://t.me/ssternenko/21719"
21.10.2023 17:27:03 UTC+03:00,"Батальйон ""Спарта"" ФПВ дроном атакує український танк на північний схід від населеного пункту Первомайське, Донецька область.Location: NE of Pervomaiske, Donetsk Oblast, Ukraine48.116705, 37.638667Source:https://t.me/orbSparta_Officially/14"
21.10.2023 22:42:06 UTC+03:00,"63-й батальйон 103-ї бригади ТрО скидами знищує/пошкоджує російські вантажівки в населеному пункті Володимирівка, Луганська область.Location: Volodymyrivka, Luhansk Oblast, Ukraine49.591994, 37.979301Source:https://t.me/it_ta_batia_63/76"
22.10.2023 14:46:26 UTC+03:00,"Російська артилерія обстрілює українські позиції на північний захід від населеного пункту Орлянське, Харківська область.Location: NW of Orlianske, Kharkiv Oblast, Ukraine49.698295, 37.908154Source:https://t.me/natoptishh/1989"
22.10.2023 18:23:07 UTC+03:00,"54-та ОМБр знищує російську піхоту та танк на північ від населеного пункту Золотарівка, Луганська область.Location: N of Zolotarivka, Luhansk Oblast, Ukraine48.900864, 38.26202848.897313, 38.275927Source:https://t.me/osirskiy/400"
22.10.2023 19:39:26 UTC+03:00,"Т-80БВ спецпідрозділу ""Kraken"" працює по російській піхоті в населеному пункті Ягідне, Харківська область.Location: Yahidne, Kharkiv Oblast, Ukraine49.666874, 37.923499Source:https://t.me/kraken_kha/452"
